{
  "$schema": "./schemas/linkos.config.schema.json",
  "schemaVersion": 1,
  "tools": { "node": "node", "go": "go", "pnpmVersion": "9.15.5" },
  "dev": {
    "home": ".local/linkos",
    "host": "0.0.0.0",
    "port": "5175",
    "lanIP": "auto",
    "publicHost": "auto",
    "https": true,
    "vitePort": "auto"
  },
  "pack": {
    "outDir": "release",
    "targets": ["windows/amd64", "linux/amd64", "linux/arm64"]
  }
}
